<?xml version="1.0" encoding="UTF-8"?>
<xs:schema xmlns:xs="http://www.w3.org/2001/XMLSchema" elementFormDefault="qualified">

<!-- Version 2013/08/20 -->
<!-- 
	Changelog:
	8/20/13 - Added PNCS Value Field to the allowed measurementConstants
	3/06/13	- Removed unnecessary enum values.
	1/17/13	- Changing the wording of the measurementConstants to be more user friendly.
	1/15	- Changed point from a float to a double and allowed to to be a double or a long.  Also changed the way it is structured, 
				so that the generated java code uses inheritance, instead of a choice (closer alignment to sim-api which uses Number, 
				but that can't be mapped from XML - double or long should let us hold anything we need to)
	1/10	- Reorganized Bound and Interval under measurement to better align with the sim-api.  No changes to what is representable.
				Got rid of timing node, which served no purpose (moved measurement up a level under the assertion)
	1/8		- Getting rid of the unnecessary assertionComponents field.  Allowed the assertionComponent in assertion to be an unbounded
				list instead of a single reference instead.
	1/4		- Added (optional) comment fields to the Lego and the Lego List.
	12/14	- Got rid of 'expressionConjuction' - no longer necessary now that we have the 'expression' type.
	12/13	- Moved relationships from concept to a new type 'expression'.  'discernible', 'qualifier', 'value' and 'destination'
				have their target types changed to 'expression'.  'type' and 'units' remain as concept - so type and units can no longer
				have nested rels.
			- Renamed 'conceptConjunction' to 'expressionConjunction'.  Reordered the elements within for consistency.
	12/07	- Renamed 'rel' to 'relation' for consistency.  
			- Added 'relationGroup' as a possible target of 'concept', instead of just 'relation'.  
			- Created 'conceptConjunction' - added as a possible target for 'discernible', 'qualifier', 'value', 'destination'
			- Created 'boolean' and 'text' as new types - can be used within a 'value' or a 'destination'
			- Renamed 'stringValue' to 'stringConstant' within 'point' to make it more clear, help differentiate from the new literal
				'text' type which allows any string.
	11/28	- removed minOccur=0 from measurement in timing - it didn't make sense.  If you have a timing, you need a measurement.
	11/26	- added a UUID to the stamp for lego editor sanity - otherwise, there was nothing to define a unique lego.  
				Now, stampUUID + legoUUID is globally unique.
 -->

	<xs:element name="legoList">
		<xs:complexType>
			<xs:sequence>
				<xs:element name="groupName" type="xs:string" />
				<xs:element name="legoListUUID" type="UUID" />
				<xs:element name="groupDescription" type="xs:string" minOccurs="0" />
				<xs:element name="comment" type="xs:string" minOccurs="0" />
				<xs:element ref="lego" maxOccurs="unbounded" />
			</xs:sequence>
		</xs:complexType>
	</xs:element>

	<xs:element name="lego">
		<xs:complexType>
			<xs:sequence>
				<xs:element name="legoUUID" type="UUID" />
				<xs:element ref="stamp" />
				<xs:element ref="pncs" />
				<xs:element ref="assertion" minOccurs="1" maxOccurs="unbounded" />
				<xs:element name="comment" type="xs:string" minOccurs="0" />
			</xs:sequence>
		</xs:complexType>
	</xs:element>

	<xs:element name="assertion">
		<xs:complexType>
			<xs:sequence>
				<xs:element name="assertionUUID" type="UUID" />
				<xs:element ref="discernible" />
				<xs:element ref="qualifier" />
				<xs:element ref="value" />
				<xs:element name="timing" type="measurement" minOccurs="0" />
				<xs:element ref="assertionComponent" minOccurs="0" maxOccurs="unbounded"/>
			</xs:sequence>
		</xs:complexType>
	</xs:element>

	<xs:simpleType name="UUID">
		<xs:restriction base="xs:string">
			<xs:pattern value="[a-f0-9]{8}-[a-f0-9]{4}-[a-f0-9]{4}-[a-f0-9]{4}-[a-f0-9]{12}" />
		</xs:restriction>
	</xs:simpleType>

	<xs:element name="pncs">
		<xs:complexType>
			<xs:attribute name="id" use="required" type="xs:int" />
			<xs:attribute name="name" use="required" type="xs:string" />
			<xs:attribute name="value" use="required" type="xs:string" />
		</xs:complexType>
	</xs:element>

	<xs:element name="assertionComponent">
		<xs:complexType>
			<xs:sequence>
				<xs:element name="assertionUUID" type="UUID"/>
				<xs:element ref="type"/>
			</xs:sequence>
		</xs:complexType>
	</xs:element>
	
	<xs:element name="type">
		<xs:complexType>
			<xs:sequence>
				<xs:element ref="concept"/>
			</xs:sequence>
		</xs:complexType>
	</xs:element>

	<xs:element name="expression">
		<xs:complexType>
			<xs:sequence>
				<xs:choice>
					<xs:element ref="concept"/>
					<xs:element ref="expression" minOccurs="2" maxOccurs="unbounded"/>
				</xs:choice>
				<xs:element ref="relation" minOccurs="0" maxOccurs="unbounded"/>
				<xs:element ref="relationGroup" minOccurs="0" maxOccurs="unbounded"/>
			</xs:sequence>
		</xs:complexType>
	</xs:element>

	<xs:element name="concept">
		<xs:complexType>
			<xs:attribute name="sctid" use="optional" type="xs:long" />  <!-- Ideally, I would say that at least one of the IDs must exist, but there isn't a good way to do that in schema -->
			<xs:attribute name="uuid" use="optional" type="UUID" />
			<xs:attribute name="desc" use="required" type="xs:string" />
		</xs:complexType>
	</xs:element>
	
	<xs:element name="discernible">
		<xs:complexType>
			<xs:sequence>
				<xs:element ref="expression"/>
			</xs:sequence>
		</xs:complexType>
	</xs:element>

	<xs:element name="qualifier">
		<xs:complexType>
			<xs:sequence>
				<xs:element ref="expression"/>
			</xs:sequence>
		</xs:complexType>
	</xs:element>

	<xs:element name="value">
		<xs:complexType>
			<xs:sequence>
				<xs:choice>
					<xs:element ref="expression"/>
					<xs:element ref="text" />
					<xs:element ref="boolean" />
					<xs:element name="measurement" type="measurement" />
				</xs:choice>
			</xs:sequence>
		</xs:complexType>
	</xs:element>

	<xs:element name="relation">
		<xs:complexType>
			<xs:sequence>
				<xs:element ref="type"/>
				<xs:element ref="destination"/>
			</xs:sequence>
		</xs:complexType>
	</xs:element>
	
	<xs:element name="relationGroup">
		<xs:complexType>
			<xs:sequence>
				<xs:element ref="relation" minOccurs="1" maxOccurs="unbounded"/>
			</xs:sequence>
		</xs:complexType>
	</xs:element>
	
	<xs:element name="destination">
		<xs:complexType>
			<xs:sequence>
				<xs:choice>
					<xs:element ref="expression"/>
					<xs:element ref="text" />
					<xs:element ref="boolean" />
					<xs:element name="measurement" type="measurement"/>
				</xs:choice>
			</xs:sequence>
		</xs:complexType>
	</xs:element>

	<xs:simpleType name="measurementConstant">
		<xs:restriction base="xs:string">
			<xs:enumeration value="DOB" />
			<xs:enumeration value="NOW" />
			<xs:enumeration value="start active service" />
			<xs:enumeration value="end active service" />
			<xs:enumeration value="PNCS Value Field" />
		</xs:restriction>
	</xs:simpleType>

	<xs:element name="text" type="xs:string"/>

    <xs:element name="boolean" type="xs:boolean"/>
    
	<xs:complexType name="measurement">
		<xs:sequence>
			<xs:element ref="units" minOccurs="0" maxOccurs="1" />
			<xs:choice>
				<xs:element name="point" type="point"/>
				<xs:element name="bound" type="bound" />
				<xs:element ref="interval" />
			</xs:choice>
		</xs:sequence>
	</xs:complexType>

	<xs:complexType name="bound">
		<xs:sequence>
			<!-- I'd like to define that at least one of these must exist, but when you do that the really cryptic way that xml schema requires, it makes the generated jaxb really ugly. -->
			<xs:element name="lowerPoint" type="point"  minOccurs="0"/>
			<xs:element name="upperPoint" type="point" minOccurs="0"/>
		</xs:sequence>
		<xs:attribute name="lowerPointInclusive" type="xs:boolean"/>
		<xs:attribute name="upperPointInclusive" type="xs:boolean"/>
	</xs:complexType>

	<xs:element name="interval">
		<xs:complexType>
			<xs:sequence> 
				<!-- I'd like to define that at least one of these must exist, but when you do that the really cryptic way that xml schema requires, it makes the generated jaxb really ugly. -->
				<xs:element name="lowerBound" type="bound" minOccurs="0" />
				<xs:element name="upperBound" type="bound" minOccurs="0" />
			</xs:sequence>
		</xs:complexType>
	</xs:element >
	
	<xs:complexType name="point" abstract="true"/>
	
	<xs:complexType name="pointLong" >
		<xs:complexContent>
			<xs:extension base="point">
				<xs:sequence>
					<xs:element name="value" type="xs:long"/>
				</xs:sequence>
			</xs:extension>
		</xs:complexContent>
	</xs:complexType>
	
	<xs:complexType name="pointDouble" >
		<xs:complexContent>
			<xs:extension base="point">
				<xs:sequence>
					<xs:element name="value" type="xs:double"/>
				</xs:sequence>
			</xs:extension>
		</xs:complexContent>
	</xs:complexType>
	
	<xs:complexType name="pointMeasurementConstant" >
		<xs:complexContent>
			<xs:extension base="point">
				<xs:sequence>
					<xs:element name="value" type="measurementConstant"/>
				</xs:sequence>
			</xs:extension>
		</xs:complexContent>
	</xs:complexType>

	<xs:element name="units">
		<xs:complexType>
			<xs:sequence>
				<xs:element ref="concept"/>
			</xs:sequence>
		</xs:complexType>
	</xs:element>

	<xs:element name="stamp">
		<xs:complexType>
			<xs:attribute name="status" use="optional" type="xs:string" />
			<xs:attribute name="time" use="optional" type="xs:dateTime" />
			<xs:attribute name="author" use="optional" type="xs:string" />
			<xs:attribute name="module" use="optional" type="xs:string" />
			<xs:attribute name="path" use="optional" type="xs:string" />
			<xs:attribute name="uuid" use="optional" type="UUID" />  <!--  Adding this for sanity in the GUI - uniquely identifies the stamp, this UUID plus lego UUID uniquely identifies a lego -->
		</xs:complexType>
	</xs:element>

</xs:schema>