<?xml version="1.0" encoding="UTF-8" standalone="yes"?>
<legoList xmlns:xsi="http://www.w3.org/2001/XMLSchema-instance" xsi:noNamespaceSchemaLocation="LEGO.xsd">
    <groupName>Audiology OBSERVABLES</groupName>
    <legoListUUID>530391c6-fe77-4638-ba99-1c33cae59ab5</legoListUUID>
    <groupDescription>Observables for new VA Audiology form</groupDescription>
    <comment></comment>
    <lego>
        <legoUUID>2601a0fa-3f0f-453c-9186-9ddf5dec3fd9</legoUUID>
        <stamp status="Active" time="2013-07-30T19:47:23.770-07:00" author="dsperzel" module="default module" path="default path" uuid="f681273f-d2f0-455a-bae2-0be1e83426d7"/>
        <pncs id="26274" name="Claim for tinnitus" value="Yes"/>
        <assertion>
            <assertionUUID>96cd1743-65e0-418c-958f-1a9215007299</assertionUUID>
            <discernible>
                <expression>
                    <concept sctid="1217" uuid="6a61d423-d02a-3c56-a50d-c23ae7ff12f3" desc="VA benefit claim filed  (observable entity) "/>
                    <relation>
                        <type>
                            <concept sctid="53" uuid="d82c8d16-19ad-3176-9665-453cfb2e55f0" desc="IS ABOUT (attribute)"/>
                        </type>
                        <destination>
                            <expression>
<concept sctid="155248003" uuid="abba4bbd-0223-3987-8b19-7ddd52e779b5" desc="Tinnitus (disorder)"/>
                            </expression>
                        </destination>
                    </relation>
                </expression>
            </discernible>
            <qualifier>
                <expression>
                    <concept sctid="108217004" uuid="ed2f734a-9196-3410-ae04-751808edf584" desc="Interview, history AND/OR physical examination (procedure)"/>
                </expression>
            </qualifier>
            <value>
                <expression>
                    <concept sctid="373066001" uuid="c928767e-f519-3b34-bff2-a2ed3cd5c6c3" desc="Yes (qualifier value)"/>
                </expression>
            </value>
        </assertion>
    </lego>
    <lego>
        <legoUUID>264ba329-f10f-4e98-bf2a-04a39ed629bf</legoUUID>
        <stamp status="Active" time="2013-07-30T19:53:07.808-07:00" author="dsperzel" module="default module" path="default path" uuid="b8f84c65-06e1-4418-8633-03f8bd4ba2b9"/>
        <pncs id="26274" name="Claim for tinnitus" value="No"/>
        <assertion>
            <assertionUUID>da89cc8e-265f-4029-bf6c-9aeedfca9782</assertionUUID>
            <discernible>
                <expression>
                    <concept sctid="1217" uuid="6a61d423-d02a-3c56-a50d-c23ae7ff12f3" desc="VA benefit claim filed  (observable entity) "/>
                    <relation>
                        <type>
                            <concept sctid="53" uuid="d82c8d16-19ad-3176-9665-453cfb2e55f0" desc="IS ABOUT (attribute)"/>
                        </type>
                        <destination>
                            <expression>
<concept sctid="155248003" uuid="abba4bbd-0223-3987-8b19-7ddd52e779b5" desc="Tinnitus (disorder)"/>
                            </expression>
                        </destination>
                    </relation>
                </expression>
            </discernible>
            <qualifier>
                <expression>
                    <concept sctid="108217004" uuid="ed2f734a-9196-3410-ae04-751808edf584" desc="Interview, history AND/OR physical examination (procedure)"/>
                </expression>
            </qualifier>
            <value>
                <expression>
                    <concept sctid="373067005" uuid="d58a8003-b801-3da2-83c1-e09497c9bb53" desc="No (qualifier value)"/>
                </expression>
            </value>
        </assertion>
    </lego>
</legoList>
